variant,task,total_latency,latency_planner,latency_researcher,latency_writer,latency_critic
controller,Explain the causes of the 2008 financial crisis in 3 paragraphs.,46.91707682609558,10.470546960830688,14.855327367782593,9.85649585723877,11.73470664024353
controller,Explain how transformers work in NLP.,55.35673260688782,11.03563904762268,16.990102291107178,17.08172297477722,10.249268293380737
controller,Summarize the pros and cons of renewable energy.,43.793009757995605,6.307075500488281,17.649876356124878,10.731943130493164,9.104114770889282
controller,Describe the key events of World War 1.,54.26222467422485,8.96646523475647,20.834648847579956,13.128901720046997,11.33220887184143
controller,Explain gradient descent in machine learning.,39.71089220046997,8.172358274459839,12.139703035354614,9.709890842437744,9.688940048217773
controller,What are the main causes of inflation?,47.24495840072632,6.540159225463867,16.470587015151978,13.826189279556274,10.4080228805542
