variant,task,total_latency,latency_planner,latency_controller,latency_researcher,latency_writer,latency_critic
controller,Explain the causes of the 2008 financial crisis in 3 paragraphs.,72.01703357696533,16.697531700134277,0,16.16366720199585,24.042056560516357,15.113778114318848
controller,Explain how transformers work in NLP.,74.96992826461792,11.31019139289856,0,20.92745089530945,22.17820119857788,20.55408477783203
controller,Summarize the pros and cons of renewable energy.,53.94941782951355,10.590052843093872,0,12.295657396316528,16.753592014312744,14.310115575790405
controller,Describe the key events of World War 1.,67.73843741416931,12.646897554397583,0,19.343544483184814,22.596094131469727,13.151901245117188
controller,Explain gradient descent in machine learning.,60.12829089164734,10.865656614303589,0,12.272212982177734,21.086977005004883,15.903444290161133
controller,What are the main causes of inflation?,78.37337040901184,8.348671436309814,0,24.404624462127686,27.669575929641724,17.950498580932617
